{
  "format": "2",
  "generatorVersion": "0.5.0",
  "root": ".",
  "validityBasis": "aggregate-source-digest",
  "repositoryState": {
    "available": true,
    "validationRole": "provenance",
    "repositories": [
      {
        "path": ".",
        "commit": "acdc3ecdf29781711287894b133a9a52aff46604",
        "branch": "main",
        "dirty": true,
        "remote": "https://github.com/zachshallbetter/semantic-cms.git"
      }
    ]
  },
  "aggregateSourceDigest": "95a9772305551953ada74d156b9843322c92dba49d7c35949e59f709c55a2035",
  "sources": [
    {
      "path": ".agents/skills/compile-context/SKILL.md",
      "bytes": 561,
      "sha256": "10c8156d05da083eddb606769183d8cabf4f924c241a3e3b462ef76f7aecf28d"
    },
    {
      "path": ".agents/skills/coordinate-workers/SKILL.md",
      "bytes": 593,
      "sha256": "6be105841accc1f67dc11e12541b3b343fa2029a0ff6e5085c907b36381ba57b"
    },
    {
      "path": ".agents/skills/operate-frontier/SKILL.md",
      "bytes": 725,
      "sha256": "d3a6730cc1e450feb4840060025899d4a4d17d6c935a8b3ea57ee4302d651172"
    },
    {
      "path": ".agents/skills/reconcile-project/SKILL.md",
      "bytes": 648,
      "sha256": "ed45e3b970480a0bed390757fef2d9abe2471bf37835d764f939022600995333"
    },
    {
      "path": ".agents/skills/verify-outcome/SKILL.md",
      "bytes": 599,
      "sha256": "331bcc9c5179eef021d9edf48e76bedcaaef6fed17f97e91c6d20a20f1199117"
    },
    {
      "path": ".claude/launch.json",
      "bytes": 374,
      "sha256": "0cdc9f914c5b663b01ecc7867b4f82ea38d2b0394d9034d0b6b2701033d8c544"
    },
    {
      "path": ".formal-bootstrap.json",
      "bytes": 280,
      "sha256": "7fa912028d7ee4ad128c719342834ec735a28354ad614a13cd9a91599d0e7c0d"
    },
    {
      "path": ".github/pull_request_template.md",
      "bytes": 1320,
      "sha256": "008c2ede60632b5bbf6ffaa97a95b9972b3ca10804eb712afbf3c436f5651963"
    },
    {
      "path": ".github/workflows/gates.yml",
      "bytes": 6478,
      "sha256": "9232dc063ff26f399c84a5c498b7815c458fb4d5e465b4f406cd217540c0af7f"
    },
    {
      "path": "AGENTS.md",
      "bytes": 7498,
      "sha256": "93362a4ff5f38de2e2352bc34499b880b5ba2cdcfef959189226229e5320fbd1"
    },
    {
      "path": "CONTEXT_SOURCES.json",
      "bytes": 914,
      "sha256": "1a0e0db180b061204f20b4a550f8b634fb2a220569592bd63fed13eb875dda0e"
    },
    {
      "path": "DESIGN.md",
      "bytes": 35290,
      "sha256": "62603e98c3ac16360001e13396a40e54b671ce4545a5a9cd654f5257a56760c5"
    },
    {
      "path": "FORMAL_RESOURCE_MANIFEST.json",
      "bytes": 14629,
      "sha256": "34721692f8b95cf5a6d03c267ea34ab7f2fb3e553951ef7af71f75426adf92ae"
    },
    {
      "path": "NEW_AGENT_PROMPT.md",
      "bytes": 1021,
      "sha256": "5df98ccb46c4e6511e59e10a2783a67454cbc29b3ee0af507061789592993cfc"
    },
    {
      "path": "PROJECT_INTENT.md",
      "bytes": 6430,
      "sha256": "aa9fa7805702ad934d0920ef4f6445845b787c0b6a5c5545032ede47ab305989"
    },
    {
      "path": "PROJECT_PROFILE.json",
      "bytes": 1921,
      "sha256": "a2e82bd569b5897551b55fe21f099baf1d8f7217feaf1fc8e9d7e9d9239b1e81"
    },
    {
      "path": "README.md",
      "bytes": 1802,
      "sha256": "a844d7c44767ce1053af3c2ce427061208bae53c67415cc6a7c285e3a649b996"
    },
    {
      "path": "SPEC_HEALTH.md",
      "bytes": 27176,
      "sha256": "749b0742bee3b2acc5f9e3693e3582a686f8df2c357c10a7b9ac9916b1769380"
    },
    {
      "path": "VERSION",
      "bytes": 6,
      "sha256": "a0ad50640139a524f86591157145bf1d4674ea9c065bfea21558f0f7b04430c8"
    },
    {
      "path": "bindings/PROJECT_BINDINGS.yaml",
      "bytes": 13060,
      "sha256": "7141154bb8cbcfd25e7a96003cb731538aae1a36c70888f401a12b29ff28d04e"
    },
    {
      "path": "contracts/README.md",
      "bytes": 387,
      "sha256": "574c6218c0c957efb2eb3bfa4bf51fbf3ab0165cc81a033a249d4ba4cc2af78e"
    },
    {
      "path": "docs/AGENT_CAPABILITIES.md",
      "bytes": 1095,
      "sha256": "9dd7e5efd745a85880c8b428ab41d25c994c033e7f5d1376a6defd343cbfdb68"
    },
    {
      "path": "docs/ALIGNMENT.md",
      "bytes": 1588,
      "sha256": "9e241f47e102b9feeb3b8e6bff3c95a146d69384f196eefc2327b363a96bf7a0"
    },
    {
      "path": "docs/AUTHORITY_MODEL.md",
      "bytes": 2592,
      "sha256": "abc1aac1d90b78a5e084549ef4f15e3a299f0894e521040f85261ea55acf5fc0"
    },
    {
      "path": "docs/BOOTSTRAP_SEQUENCE.md",
      "bytes": 6140,
      "sha256": "82d04fa96aa477837c64b61a7c5f9e7617d0e325ef3e205dbd037f6ff1e91d51"
    },
    {
      "path": "docs/CONFORMANCE.md",
      "bytes": 3027,
      "sha256": "91a89475f94537685db35af38306d5455ee9bb30488fb5247527293a2e0320ba"
    },
    {
      "path": "docs/CONTEXT_COMPILATION.md",
      "bytes": 1601,
      "sha256": "214a8af8fa1e25b6488f293d43842efce0225cf40aba460a8ae99d5c850d3599"
    },
    {
      "path": "docs/EVIDENCE_METHOD.md",
      "bytes": 1039,
      "sha256": "a7422b9cc99adfc462a8c6d44ee883f9483c1127fbcaf0f44b1328d1d30fd4c9"
    },
    {
      "path": "docs/EXECUTION_PIPELINE.md",
      "bytes": 1861,
      "sha256": "529c01ec25ac7d0552a19d591514244ec7bbe3f1966f1dd38d2c2f69494ba2db"
    },
    {
      "path": "docs/EXECUTION_PROVIDER_CONTRACT.md",
      "bytes": 1669,
      "sha256": "e9587fea1bd67229f6588600512e6b9539d510ba000c0190b2c05f67eda0cf19"
    },
    {
      "path": "docs/EXISTING_PROJECT_ADOPTION.md",
      "bytes": 4530,
      "sha256": "6cfaf7daa1669ed717571ecd43e3b5950151d39641d1adaff6a16843a954c6c7"
    },
    {
      "path": "docs/FORMAL_RESOURCES.md",
      "bytes": 2845,
      "sha256": "bf93374182ba0212c7e64328a751c9dc3cfacd816779f983eca50f9157851289"
    },
    {
      "path": "docs/HANDOFF-2026-08-30.md",
      "bytes": 11533,
      "sha256": "8a0463c0ae7280272e7b4938a48dbc8831aaefeab9cf695e55765c009cf78692"
    },
    {
      "path": "docs/INITIAL_EPICS_TEMPLATE.md",
      "bytes": 1234,
      "sha256": "c3e6414393bbfb7905b4113f10571a695204538c19bbab90b5a486e7ae6a3039"
    },
    {
      "path": "docs/LANDING_AND_PROMOTION.md",
      "bytes": 1135,
      "sha256": "675a228edb135427a399e08c7fdf3a983a7802da5a20d63deb83af40fe366a23"
    },
    {
      "path": "docs/MULTI_AGENT_COORDINATION.md",
      "bytes": 2078,
      "sha256": "c27fc5594ef31ff4574582b4c6f2e69dc684bb897b9f9455fce1b50ca44f968a"
    },
    {
      "path": "docs/NEGATIVE_KNOWLEDGE.md",
      "bytes": 1005,
      "sha256": "cb1e5e5b1f3748fc9f879ca9e5e3914a043c44c707ee082dc3fee1878a79889f"
    },
    {
      "path": "docs/RECOVERY.md",
      "bytes": 1115,
      "sha256": "b084f0a4bbad4012bd9d2525a07239e38ff4f563bbdefbd8491518fec14882e9"
    },
    {
      "path": "docs/SKILLS_INDEX.md",
      "bytes": 763,
      "sha256": "05da80f8e5564e351603f467963cf5820c5ddaf78187566c2da7d1abae2754a5"
    },
    {
      "path": "docs/UI/01-SEMANTIC-CMS.md",
      "bytes": 5152,
      "sha256": "1d0e4dfd01fc33d224d0f57cb45c4bb82d61b1de0e6971cc0f82538a07ba5ab2"
    },
    {
      "path": "docs/UI/02-MENTAL-MODEL.md",
      "bytes": 1986,
      "sha256": "a63caba2b79118138fd53d2e372a9f93c284ca9be4b6a54311fb22d3c817a081"
    },
    {
      "path": "docs/UI/03-IN-USE.md",
      "bytes": 2712,
      "sha256": "1d0fe92ba08b7265300711c10e527e8698c1ec9ff158f28b99b867c94e497946"
    },
    {
      "path": "docs/UI/04-UNIQUENESS.md",
      "bytes": 2293,
      "sha256": "bb5fa37d1d65501fa71c2b4d16b5dc15f803d365b6bc29de05fd06c6a30584ea"
    },
    {
      "path": "docs/UI/05-UI-VISUAL-LANGUAGE.md",
      "bytes": 3884,
      "sha256": "31a1f19c5e896e2ec206b72ed8f489679d00d440e041d8518f06fd5f37c2bf47"
    },
    {
      "path": "docs/UI/06-INTERACTION-PRINCIPLES.md",
      "bytes": 1950,
      "sha256": "aa6259cd98df41cd5e6eed47eba933fd82e1c737f0609b8636824844762b71c3"
    },
    {
      "path": "docs/UI/07-CANON-SURFACE-EXPRESSION-INTERACTION.md",
      "bytes": 2041,
      "sha256": "c303e8894664bb5a7dad310e2ed3bba5d63115ffea1e24702fd9665c15079087"
    },
    {
      "path": "docs/UI/08-GLOSSARY.md",
      "bytes": 1961,
      "sha256": "f67ed25ea07978e6ee7bde24746ed71f84dc8d75ef362c0fdfffb50787a4ae54"
    },
    {
      "path": "docs/UI/README.md",
      "bytes": 1709,
      "sha256": "92aa724ee6c14ab7612d70890a8c364a46e8f9d8a49fcc842817a9a3f5e19ce8"
    },
    {
      "path": "docs/WORK_GRAPH.md",
      "bytes": 1790,
      "sha256": "427012a108e0b551cf656690da51c74675d0aa99cb138b8d4cf61bfa32691a22"
    },
    {
      "path": "fixtures/zach-core-manifest.json",
      "bytes": 169185,
      "sha256": "d9d1effba80c14a8cdbb7a5de78b17cdfc2df497cb068114413c91a11e7a8c08"
    },
    {
      "path": "impl/authoring/package.json",
      "bytes": 408,
      "sha256": "36ebd0b3643d55846911fd21083b88813998b8e65bcc99e65429168b4b33fb5c"
    },
    {
      "path": "impl/authoring/src/editor.ts",
      "bytes": 5310,
      "sha256": "f64d6b272820e630202fb2cd66e01264000b77704a3bf3bfda38680d44c14bf5"
    },
    {
      "path": "impl/authoring/test/authoring.test.ts",
      "bytes": 9452,
      "sha256": "d56fb393c050facbeb83a4868bd2edd0c81970c26e1feabac875935adfbd33df"
    },
    {
      "path": "impl/canon/package.json",
      "bytes": 499,
      "sha256": "30ef327c197026651ecb22ee3d9017bb861f4bd3410b783fb521daf5b86446a9"
    },
    {
      "path": "impl/canon/src/envelope.ts",
      "bytes": 5142,
      "sha256": "e796d7c89dad9e020c10ae22a4f0d1b6d05dfbbc63e9f2676b7a920e21cc9361"
    },
    {
      "path": "impl/canon/src/freeze.ts",
      "bytes": 6873,
      "sha256": "f6d4f8dfe4e85900337063e76cf5baa57c039d76132c07431cccff201078d7e0"
    },
    {
      "path": "impl/canon/src/journal.ts",
      "bytes": 11933,
      "sha256": "e558c7989ef70c445cc0f4671135de8c68adf9ccf12d5ac9decebf9db5322241"
    },
    {
      "path": "impl/canon/test/canon.test.ts",
      "bytes": 20260,
      "sha256": "93b9a7707b0d9e03d41e8354d5bb7051870a392e9e818e8889a43b3b213500ed"
    },
    {
      "path": "impl/contracts/package.json",
      "bytes": 523,